{
  "region": "TEST",
  "healthcare": {
    "generalBeds": 314310,
    "criticalBeds": 11350
  },
  "vaccination": {
    "efficacyInfection": 0.9,
    "efficacyDisease": 0.96,
    "maxDosesPerWeek": null,
    "strategy": "HCW and Elderly",
    "uptake": 0.2,
    "availability": 0.9,
    "durability": 1095,
    "riskProportion": 0.1,
    "future": null
  },
  "rt": [
    {
      "start": "2020-04-05",
      "value": 2.4
    }
  ],
  "simulation": {
    "forecastDays": 40
  }
}
